{
  "schemaVersion": "1.0.0",
  "featureSchemaVersion": "phase-2-loan-features.v1.0.0",
  "featureOrder": ["annualIncome", "monthlyIncomeMean", "monthlyIncomeVolatility", "debtToIncomeRatio", "existingDebtAmount", "delinquencyCount", "platformSettlementMonths", "platformSettlementMean", "platformSettlementVolatility", "contractDurationMonths", "incomeDeclarationAvailable", "telecomPaymentDelinquencyCount"],
  "features": [
    { "name": "annualIncome", "valueType": "number", "required": true, "nullable": false, "unit": "KRW", "minimum": 0, "maximum": 1000000000, "description": "Declared annual income.", "sourceCategory": "APPLICANT_DECLARED", "allowedUse": "LOAN_PROPOSAL_GENERATION", "missingValuePolicy": "REJECT_REQUEST", "preprocessingExpectation": "log1p then scale", "sensitiveDataClassification": "PURPOSE_LIMITED_FINANCIAL" },
    { "name": "monthlyIncomeMean", "valueType": "number", "required": true, "nullable": false, "unit": "KRW", "minimum": 0, "maximum": 100000000, "description": "Mean monthly income.", "sourceCategory": "DERIVED", "allowedUse": "LOAN_PROPOSAL_GENERATION", "missingValuePolicy": "REJECT_REQUEST", "preprocessingExpectation": "scale", "sensitiveDataClassification": "PURPOSE_LIMITED_FINANCIAL" },
    { "name": "monthlyIncomeVolatility", "valueType": "number", "required": true, "nullable": false, "unit": "RATIO", "minimum": 0, "maximum": 10, "description": "Income volatility ratio.", "sourceCategory": "DERIVED", "allowedUse": "LOAN_PROPOSAL_GENERATION", "missingValuePolicy": "REJECT_REQUEST", "preprocessingExpectation": "clip 0..10", "sensitiveDataClassification": "NON_PII_DERIVED" },
    { "name": "debtToIncomeRatio", "valueType": "number", "required": true, "nullable": false, "unit": "RATIO", "minimum": 0, "maximum": 5, "description": "Debt to income ratio.", "sourceCategory": "DERIVED", "allowedUse": "LOAN_PROPOSAL_GENERATION", "missingValuePolicy": "REJECT_REQUEST", "preprocessingExpectation": "clip 0..5", "sensitiveDataClassification": "NON_PII_DERIVED" },
    { "name": "existingDebtAmount", "valueType": "number", "required": true, "nullable": false, "unit": "KRW", "minimum": 0, "maximum": 1000000000, "description": "Existing debt amount.", "sourceCategory": "LOAN_SYSTEM", "allowedUse": "LOAN_PROPOSAL_GENERATION", "missingValuePolicy": "REJECT_REQUEST", "preprocessingExpectation": "log1p then scale", "sensitiveDataClassification": "PURPOSE_LIMITED_FINANCIAL" },
    { "name": "delinquencyCount", "valueType": "integer", "required": true, "nullable": false, "unit": "COUNT", "minimum": 0, "maximum": 120, "description": "Loan delinquency count.", "sourceCategory": "LOAN_SYSTEM", "allowedUse": "LOAN_PROPOSAL_GENERATION", "missingValuePolicy": "REJECT_REQUEST", "preprocessingExpectation": "clip 0..120", "sensitiveDataClassification": "PURPOSE_LIMITED_FINANCIAL" },
    { "name": "platformSettlementMonths", "valueType": "integer", "required": true, "nullable": false, "unit": "MONTHS", "minimum": 0, "maximum": 240, "description": "Settlement history months.", "sourceCategory": "SETTLEMENT_HISTORY", "allowedUse": "LOAN_PROPOSAL_GENERATION", "missingValuePolicy": "REJECT_REQUEST", "preprocessingExpectation": "scale", "sensitiveDataClassification": "PURPOSE_LIMITED_FINANCIAL" },
    { "name": "platformSettlementMean", "valueType": "number", "required": true, "nullable": false, "unit": "KRW", "minimum": 0, "maximum": 100000000, "description": "Average platform settlement.", "sourceCategory": "SETTLEMENT_HISTORY", "allowedUse": "LOAN_PROPOSAL_GENERATION", "missingValuePolicy": "REJECT_REQUEST", "preprocessingExpectation": "log1p then scale", "sensitiveDataClassification": "PURPOSE_LIMITED_FINANCIAL" },
    { "name": "platformSettlementVolatility", "valueType": "number", "required": true, "nullable": false, "unit": "RATIO", "minimum": 0, "maximum": 10, "description": "Settlement volatility ratio.", "sourceCategory": "SETTLEMENT_HISTORY", "allowedUse": "LOAN_PROPOSAL_GENERATION", "missingValuePolicy": "REJECT_REQUEST", "preprocessingExpectation": "clip 0..10", "sensitiveDataClassification": "NON_PII_DERIVED" },
    { "name": "contractDurationMonths", "valueType": "integer", "required": true, "nullable": false, "unit": "MONTHS", "minimum": 0, "maximum": 240, "description": "Contract duration.", "sourceCategory": "LOAN_SYSTEM", "allowedUse": "LOAN_PROPOSAL_GENERATION", "missingValuePolicy": "REJECT_REQUEST", "preprocessingExpectation": "scale", "sensitiveDataClassification": "NON_PII_DERIVED" },
    { "name": "incomeDeclarationAvailable", "valueType": "boolean", "required": true, "nullable": false, "unit": "BOOLEAN", "description": "Whether income declaration exists.", "sourceCategory": "APPLICANT_DECLARED", "allowedUse": "LOAN_PROPOSAL_GENERATION", "missingValuePolicy": "USE_FALSE_FOR_BOOLEAN", "preprocessingExpectation": "boolean to 0/1", "sensitiveDataClassification": "NON_PII_DERIVED" },
    { "name": "telecomPaymentDelinquencyCount", "valueType": "integer", "required": true, "nullable": false, "unit": "COUNT", "minimum": 0, "maximum": 120, "description": "Telecom delinquency count.", "sourceCategory": "TELECOM_HISTORY", "allowedUse": "LOAN_PROPOSAL_GENERATION", "missingValuePolicy": "REJECT_REQUEST", "preprocessingExpectation": "clip 0..120", "sensitiveDataClassification": "PURPOSE_LIMITED_TELECOM" }
  ],
  "additionalPropertiesPolicy": "REJECT"
}
